"@id","compartment::cytoskeleton","compartment::cytosol","compartment::endoplasmic reticulum","compartment::endosome","compartment::extracellular","compartment::golgi apparatus","compartment::lysosome","compartment::mitochondrion","compartment::nucleus","compartment::peroxisome","compartment::plasma membrane","degree.layout","display name","name","name.copy","query term","selected","shared name","stringdb::canonical name","stringdb::database identifier","stringdb::description","stringdb::enhancedLabel Passthrough","stringdb::full name","stringdb::imageurl","stringdb::namespace","stringdb::node color","stringdb::node type","stringdb::sequence","stringdb::species","stringdb::STRING style","stringdb::structures","target::development level","target::family","tissue::adrenal gland","tissue::blood","tissue::bone","tissue::bone marrow","tissue::eye","tissue::gall bladder","tissue::heart","tissue::intestine","tissue::kidney","tissue::liver","tissue::lung","tissue::muscle","tissue::nervous system","tissue::pancreas","tissue::saliva","tissue::skin","tissue::spleen","tissue::stomach","tissue::thyroid gland","tissue::urine"
"stringdb:9606.ENSP00000428056","2.344478","4.755289","3.192687","1.924096","2.354602","2.895181","1.859036","2.261842","4.549927","1.599392","4.513052","9","PIK3R1","PIK3R1","PIK3R1","PIK3R1","false","PIK3R1","P85A_HUMAN","9606.ENSP00000428056","Phosphatidylinositol 3-kinase regulatory subunit alpha; Binds to activated (phosphorylated) protein-Tyr kinases, through its SH2 domain, and acts as an adapter, mediating the association of the p110 catalytic unit to the plasma membrane. Necessary for the insulin-stimulated increase in glucose uptake and glycogen synthesis in insulin-sensitive tissues. Plays an important role in signaling in response to FGFR1, FGFR2, FGFR3, FGFR4, KITLG/SCF, KIT, PDGFRA and PDGFRB. Likewise, plays a role in ITGB2 signaling. Modulates the cellular response to ER stress by promoting nuclear translocation [...] ","label: attribute=""display name"" labelsize=12 labelAlignment=left position=northeast outline=true outlineColor=white outlineTransparency=95 outlineWidth=10 background=false color=black dropShadow=false",,"https://version-12-0.string-db.org//images/Proteinpictures/pdb/8d/8dcp_B.png","stringdb","rgb(117,239,180)","protein","MSAEGYQYRALYDYKKEREEDIDLHLGDILTVNKGSLVALGFSDGQEARPEEIGWLNGYNETTGERGDFPGTYVEYIGRKKISPPTPKPRPPRPLPVAPGSSKTEADVEQQALTLPDLAEQFAPPDIAPPLLIKLVEAIEKKGLECSTLYRTQSSSNLAELRQLLDCDTPSVDLEMIDVHVLADAFKRYLLDLPNPVIPAAVYSEMISLAPEVQSSEEYIQLLKKLIRSPSIPHQYWLTLQYLLKHFFKLSQTSSKNLLNARVLSEIFSPMLFRFSAASSDNTENLIKVIEILISTEWNERQPAPALPPKPPKPTTVANNGMNNNMSLQDAEWYWGDISREEVNEKLRDTADGTFLVRDASTKMHGDYTLTLRKGGNNKLIKIFHRDGKYGFSDPLTFSSVVELINHYRNESLAQYNPKLDVKLLYPVSKYQQDQVVKEDNIEAVGKKLHEYNTQFQEKSREYDRLYEEYTRTSQEIQMKRTAIEAFNETIKIFEEQCQTQERYSKEYIEKFKREGNEKEIQRIMHNYDKLKSRISEIIDSRRRLEEDLKKQAAEYREIDKRMNSIKPDLIQLRKTRDQYLMWLTQKGVRQKKLNEWLGNENTEDQYSLVEDDEDLPHHDEKTWNVGSSNRNKAENLLRGKRDGTFLVRESSKQGCYACSVVVDGEVKHCVINKTATGYGFAEPYNLYSSLKELVLHYQHTSLVQHNDSLNVTLAYPVYAQQRR","Homo sapiens","string:","1bfj_A|1pbw_B|2pnb_A|2v1y_B|3hhm_B|4jps_B|6d81_A|6r4r_A|8dcp_B|AF-P27986","Tchem","Kinase","2.458615","3.29988","1.802928","2.957474","2.293342","2.045425","3.292981","3.07196","3.245453","3.739201","3.319375","4.669086","4.976091","2.391857","2.514905","2.664916","3.196493","2.395667","2.660957","1.783787"
"stringdb:9606.ENSP00000222254","2.032795","4.746593","1.816617","1.792466","2.112539","1.349257","1.722476","1.872701","4.630547","1.191669","2.339153","9","PIK3R2","PIK3R2","PIK3R2","PIK3R2","false","PIK3R2","P85B_HUMAN","9606.ENSP00000222254","Phosphatidylinositol 3-kinase regulatory subunit beta; Regulatory subunit of phosphoinositide-3-kinase (PI3K), a kinase that phosphorylates PtdIns(4,5)P2 (Phosphatidylinositol 4,5- bisphosphate) to generate phosphatidylinositol 3,4,5-trisphosphate (PIP3). PIP3 plays a key role by recruiting PH domain-containing proteins to the membrane, including AKT1 and PDPK1, activating signaling cascades involved in cell growth, survival, proliferation, motility and morphology. Binds to activated (phosphorylated) protein- tyrosine kinases, through its SH2 domain, and acts as an adapter, mediating t [...] ","label: attribute=""display name"" labelsize=12 labelAlignment=left position=northeast outline=true outlineColor=white outlineTransparency=95 outlineWidth=10 background=false color=black dropShadow=false",,"https://version-12-0.string-db.org//images/Proteinpictures/pdb/2y/2y3a_B.png","stringdb","rgb(117,239,178)","protein","MAGPEGFQYRALYPFRRERPEDLELLPGDVLVVSRAALQALGVAEGGERCPQSVGWMPGLNERTRQRGDFPGTYVEFLGPVALARPGPRPRGPRPLPARPRDGAPEPGLTLPDLPEQFSPPDVAPPLLVKLVEAIERTGLDSESHYRPELPAPRTDWSLSDVDQWDTAALADGIKSFLLALPAPLVTPEASAEARRALREAAGPVGPALEPPTLPLHRALTLRFLLQHLGRVASRAPALGPAVRALGATFGPLLLRAPPPPSSPPPGGAPDGSEPSPDFPALLVEKLLQEHLEEQEVAPPALPPKPPKAKPASTVLANGGSPPSLQDAEWYWGDISREEVNEKLRDTPDGTFLVRDASSKIQGEYTLTLRKGGNNKLIKVFHRDGHYGFSEPLTFCSVVDLINHYRHESLAQYNAKLDTRLLYPVSKYQQDQIVKEDSVEAVGAQLKVYHQQYQDKSREYDQLYEEYTRTSQELQMKRTAIEAFNETIKIFEEQGQTQEKCSKEYLERFRREGNEKEMQRILLNSERLKSRIAEIHESRTKLEQQLRAQASDNREIDKRMNSLKPDLMQLRKIRDQYLVWLTQKGARQKKINEWLGIKNETEDQYALMEDEDDLPHHEERTWYVGKINRTQAEEMLSGKRDGTFLIRESSQRGCYACSVVVDGDTKHCVIYRTATGFGFAEPYNLYGSLKELVLHYQHASLVQHNDALTVTLAHPVRAPGPGPPPAAR","Homo sapiens","string:","2xs6_A|2y3a_B|3l4q_C|3o5z_B|7rnu_A|AF-O00459","Tbio","Enzyme","1.974396","2.836936","1.513796","2.211762","1.857575","1.405231","2.617191","2.755285","2.845829","2.650679","2.428277","2.866979","4.872435","2.528153","1.403663","2.562294","2.098517","1.893055","2.003968","1.219497"
"stringdb:9606.ENSP00000275493","4.706026","4.848467","4.226628","5.0","5.0","4.565418","3.377267","3.292948","5.0","2.530603","4.950078","9","EGFR","EGFR","EGFR","EGFR","false","EGFR","EGFR_HUMAN","9606.ENSP00000275493","Epidermal growth factor receptor; Receptor tyrosine kinase binding ligands of the EGF family and activating several signaling cascades to convert extracellular cues into appropriate cellular responses. Known ligands include EGF, TGFA/TGF-alpha, AREG, epigen/EPGN, BTC/betacellulin, epiregulin/EREG and HBEGF/heparin- binding EGF. Ligand binding triggers receptor homo- and/or heterodimerization and autophosphorylation on key cytoplasmic residues. The phosphorylated receptor recruits adapter proteins like GRB2 which in turn activates complex downstream signaling cascades. Activates at leas [...] ","label: attribute=""display name"" labelsize=12 labelAlignment=left position=northeast outline=true outlineColor=white outlineTransparency=95 outlineWidth=10 background=false color=black dropShadow=false",,"https://version-12-0.string-db.org//images/Proteinpictures/pdb/7s/7syd_A.png","stringdb","rgb(239,213,117)","protein","MRPSGTAGAALLALLAALCPASRALEEKKVCQGTSNKLTQLGTFEDHFLSLQRMFNNCEVVLGNLEITYVQRNYDLSFLKTIQEVAGYVLIALNTVERIPLENLQIIRGNMYYENSYALAVLSNYDANKTGLKELPMRNLQEILHGAVRFSNNPALCNVESIQWRDIVSSDFLSNMSMDFQNHLGSCQKCDPSCPNGSCWGAGEENCQKLTKIICAQQCSGRCRGKSPSDCCHNQCAAGCTGPRESDCLVCRKFRDEATCKDTCPPLMLYNPTTYQMDVNPEGKYSFGATCVKKCPRNYVVTDHGSCVRACGADSYEMEEDGVRKCKKCEGPCRKVCNGIGIGEFKDSLSINATNIKHFKNCTSISGDLHILPVAFRGDSFTHTPPLDPQELDILKTVKEITGFLLIQAWPENRTDLHAFENLEIIRGRTKQHGQFSLAVVSLNITSLGLRSLKEISDGDVIISGNKNLCYANTINWKKLFGTSGQKTKIISNRGENSCKATGQVCHALCSPEGCWGPEPRDCVSCRNVSRGRECVDKCNLLEGEPREFVENSECIQCHPECLPQAMNITCTGRGPDNCIQCAHYIDGPHCVKTCPAGVMGENNTLVWKYADAGHVCHLCHPNCTYGCTGPGLEGCPTNGPKIPSIATGMVGALLLLLVVALGIGLFMRRRHIVRKRTLRRLLQERELVEPLTPSGEAPNQALLRILKETEFKKIKVLGSGAFGTVYKGLWIPEGEKVKIPVAIKELREATSPKANKEILDEAYVMASVDNPHVCRLLGICLTSTVQLITQLMPFGCLLDYVREHKDNIGSQYLLNWCVQIAKGMNYLEDRRLVHRDLAARNVLVKTPQHVKITDFGLAKLLGAEEKEYHAEGGKVPIKWMALESILHRIYTHQSDVWSYGVTVWELMTFGSKPYDGIPASEISSILEKGERLPQPPICTIDVYMIMVKCWMIDADSRPKFRELIIEFSKMARDPQRYLVIQGDERMHLPSPTDSNFYRALMDEEDMDDVVDADEYLIPQQGFFSSPSTSRTPLLSSLSATSNNSTVACIDRNGLQSCPIKEDSFLQRYSSDPTGALTEDSIDDTFLPVPEYINQSVPKRPAGSVQNPVYHNQPLNPAPSRDPHYQDPHSTAVGNPEYLNTVQPTCVNSTFDSPAHWAQKGSHQISLDNPDYQQDFFPKEAKPNGIFKGSTAENAEYLRVAPQSSEFIGA","Homo sapiens","string:","1z9i_A|2m20_A|2n5s_A|3b2u_A|3buo_A|3g5y_E|3lzb_A|4krp_A|5lv6_A|5wb7_A|6v6o_C|7syd_A|AF-P00533","Tclin","Kinase","3.027609","3.709283","2.781663","2.969442","3.338682","2.73028","3.557655","3.919359","3.63606","4.791524","4.027659","3.466944","4.518569","3.341888","3.112535","3.728087","3.464003","3.281619","3.332068","2.720439"
"stringdb:9606.ENSP00000501150","3.607714","4.782135","3.571441","3.085371","3.721687","2.97407","3.346341","3.893195","4.8","2.825752","4.562568","9","PIK3CB","PIK3CB","PIK3CB","PIK3CB","false","PIK3CB","PK3CB_HUMAN","9606.ENSP00000501150","Phosphatidylinositol 4,5-bisphosphate 3-kinase catalytic subunit beta isoform; Phosphoinositide-3-kinase (PI3K) that phosphorylates PtdIns (Phosphatidylinositol), PtdIns4P (Phosphatidylinositol 4-phosphate) and PtdIns(4,5)P2 (Phosphatidylinositol 4,5-bisphosphate) to generate phosphatidylinositol 3,4,5-trisphosphate (PIP3). PIP3 plays a key role by recruiting PH domain-containing proteins to the membrane, including AKT1 and PDPK1, activating signaling cascades involved in cell growth, survival, proliferation, motility and morphology. Involved in the activation of AKT1 upon stimulation  [...] ","label: attribute=""display name"" labelsize=12 labelAlignment=left position=northeast outline=true outlineColor=white outlineTransparency=95 outlineWidth=10 background=false color=black dropShadow=false",,"https://version-12-0.string-db.org//images/Proteinpictures/pdb/2y/2y3a_A.png","stringdb","rgb(153,239,117)","protein","MCFSFIMPPAMADILDIWAVDSQIASDGSIPVDFLLPTGIYIQLEVPREATISYIKQMLWKQVHNYPMFNLLMDIDSYMFACVNQTAVYEELEDETRRLCDVRPFLPVLKLVTRSCDPGEKLDSKIGVLIGKGLHEFDSLKDPEVNEFRRKMRKFSEEKILSLVGLSWMDWLKQTYPPEHEPSIPENLEDKLYGGKLIVAVHFENCQDVFSFQVSPNMNPIKVNELAIQKRLTIHGKEDEVSPYDYVLQVSGRVEYVFGDHPLIQFQYIRNCVMNRALPHFILVECCKIKKMYEQEMIAIEAAINRNSSNLPLPLPPKKTRIISHVWENNNPFQIVLVKGNKLNTEETVKVHVRAGLFHGTELLCKTIVSSEVSGKNDHIWNEPLEFDINICDLPRMARLCFAVYAVLDKVKTKKSTKTINPSKYQTIRKAGKVHYPVAWVNTMVFDFKGQLRTGDIILHSWSSFPDELEEMLNPMGTVQTNPYTENATALHVKFPENKKQPYYYPPFDKIIEKAAEIASSDSANVSSRGGKKFLPVLKEILDRDPLSQLCENEMDLIWTLRQDCREIFPQSLPKLLLSIKWNKLEDVAQLQALLQIWPKLPPREALELLDFNYPDQYVREYAVGCLRQMSDEELSQYLLQLVQVLKYEPFLDCALSRFLLERALGNRRIGQFLFWHLRSEVHIPAVSVQFGVILEAYCRGSVGHMKVLSKQVEALNKLKTLNSLIKLNAVKLNRAKGKEAMHTCLKQSAYREALSDLQSPLNPCVILSELYVEKCKYMDSKMKPLWLVYNNKVFGEDSVGVIFKNGDDLRQDMLTLQMLRLMDLLWKEAGLDLRMLPYGCLATGDRSGLIEVVSTSETIADIQLNSSNVAAAAAFNKDALLNWLKEYNSGDDLDRAIEEFTLSCAGYCVASYVLGIGDRHSDNIMVKKTGQLFHIDFGHILGNFKSKFGIKRERVPFILTYDFIHVIQQGKTGNTEKFGRFRQCCEDAYLILRRHGNLFITLFALMLTAGLPELTSVKDIQYLKDSLALGKSEEEALKQFKQKFDEALRESWTTKVNWMAHTVRKDYRS","Homo sapiens","string:","2y3a_A|4bfr_A|AF-P42338","Tchem","Kinase","3.214288","4.05854","3.13398","3.595197","3.091495","2.660477","3.967875","3.850166","3.880978","3.893324","3.945631","3.910423","4.484327","3.525395","2.874749","3.630261","3.705999","3.397245","3.567375","2.662457"
"stringdb:9606.ENSP00000489597","3.330055","4.844198","2.447955","2.201427","2.906012","1.906256","2.225524","4.188052","5.0","1.637886","2.939198","9","PTPN11","PTPN11","PTPN11","PTPN11","false","PTPN11","PTN11_HUMAN","9606.ENSP00000489597","Tyrosine-protein phosphatase non-receptor type 11; Acts downstream of various receptor and cytoplasmic protein tyrosine kinases to participate in the signal transduction from the cell surface to the nucleus. Positively regulates MAPK signal transduction pathway. Dephosphorylates GAB1, ARHGAP35 and EGFR. Dephosphorylates ROCK2 at 'Tyr-722' resulting in stimulatation of its RhoA binding activity. Dephosphorylates CDC73.","label: attribute=""display name"" labelsize=12 labelAlignment=left position=northeast outline=true outlineColor=white outlineTransparency=95 outlineWidth=10 background=false color=black dropShadow=false",,"https://version-12-0.string-db.org//images/Proteinpictures/pdb/7v/7vxg_A.png","stringdb","rgb(117,239,137)","protein","MTSRRWFHPNITGVEAENLLLTRGVDGSFLARPSKSNPGDFTLSVRRNGAVTHIKIQNTGDYYDLYGGEKFATLAELVQYYMEHHGQLKEKNGDVIELKYPLNCADPTSERWFHGHLSGKEAEKLLTEKGKHGSFLVRESQSHPGDFVLSVRTGDDKGESNDGKSKVTHVMIRCQELKYDVGGGERFDSLTDLVEHYKKNPMVETLGTVLQLKQPLNTTRINAAEIESRVRELSKLAETTDKVKQGFWEEFETLQQQECKLLYSRKEGQRQENKNKNRYKNILPFDHTRVVLHDGDPNEPVSDYINANIIMPEFETKCNNSKPKKSYIATQGCLQNTVNDFWRMVFQENSRVIVMTTKEVERGKSKCVKYWPDEYALKEYGVMRVRNVKESAAHDYTLRELKLSKVGQALLQGNTERTVWQYHFRTWPDHGVPSDPGGVLDFLEEVHHKQESIMDAGPVVVHCSAGIGRTGTFIVIDILIDIIREKGVDCDIDVPKTIQMVRSQRSGMVQTEAQYRFIYMAVQHYIETLQRRIEEEQKSKRKGHEYTNIKYSLADQTSGDQSPLPPCTPTPPCAEMREDSARVYENVGLMQQQKSFR","Homo sapiens","string:","1aya_A|3zm1_A|5df6_A|6cmq_A|6r5g_A|7vxg_A|AF-Q06124","Tchem","Enzyme","2.648511","4.73036","2.292233","3.182829","4.580214","2.147817","3.568032","3.193268","3.358067","4.707499","3.406324","3.435191","4.907893","2.65211","2.169584","3.161275","3.478828","3.008594","2.806284","2.027554"
"stringdb:9606.ENSP00000407586","4.554436","4.804521","4.473982","2.288375","2.658705","5.0","2.222648","2.8128","5.0","1.724544","5.0","9","HRAS","HRAS","HRAS","HRAS","false","HRAS","RASH_HUMAN","9606.ENSP00000407586","GTPase HRas, N-terminally processed; Involved in the activation of Ras protein signal transduction. Ras proteins bind GDP/GTP and possess intrinsic GTPase activity.","label: attribute=""display name"" labelsize=12 labelAlignment=left position=northeast outline=true outlineColor=white outlineTransparency=95 outlineWidth=10 background=false color=black dropShadow=false",,"https://version-12-0.string-db.org//images/Proteinpictures/pdb/6q/6q21_A.png","stringdb","rgb(117,239,213)","protein","MTEYKLVVVGAGGVGKSALTIQLIQNHFVDEYDPTIEDSYRKQVVIDGETCLLDILDTAGQEEYSAMRDQYMRTGEGFLCVFAINNTKSFEDIHQYREQIKRVKDSDDVPMVLVGNKCDLAARTVESRQAQDLARSYGIPYIETSAKTRQGVEDAFYTLVREIRQHKLRKLNPPDESGPGCMSCKCVLS","Homo sapiens","string:","6axg_D|6q21_A|AF-P01112","Tchem","Enzyme","2.820764","3.213099","2.121931","2.620172","2.375891","2.175304","3.166025","3.315088","3.152066","3.050099","3.40087","3.185019","4.665216","2.839345","2.807792","3.541103","2.806629","2.813577","3.124192","2.798699"
"stringdb:9606.ENSP00000366563","3.606415","4.801128","3.336527","3.083305","3.723614","2.692142","3.346468","3.953548","4.1875","2.824574","4.591238","9","PIK3CD","PIK3CD","PIK3CD","PIK3CD","false","PIK3CD","PK3CD_HUMAN","9606.ENSP00000366563","Phosphatidylinositol 4,5-bisphosphate 3-kinase catalytic subunit delta isoform; Phosphoinositide-3-kinase (PI3K) that phosphorylates PtdIns(4,5)P2 (Phosphatidylinositol 4,5-bisphosphate) to generate phosphatidylinositol 3,4,5-trisphosphate (PIP3). PIP3 plays a key role by recruiting PH domain-containing proteins to the membrane, including AKT1 and PDPK1, activating signaling cascades involved in cell growth, survival, proliferation, motility and morphology. Mediates immune responses. Plays a role in B-cell development, proliferation, migration, and function. Required for B-cell recepto [...] ","label: attribute=""display name"" labelsize=12 labelAlignment=left position=northeast outline=true outlineColor=white outlineTransparency=95 outlineWidth=10 background=false color=black dropShadow=false",,"https://version-12-0.string-db.org//images/Proteinpictures/pdb/6p/6pyr_A.png","stringdb","rgb(156,239,117)","protein","MPPGVDCPMEFWTKEENQSVVVDFLLPTGVYLNFPVSRNANLSTIKQLLWHRAQYEPLFHMLSGPEAYVFTCINQTAEQQELEDEQRRLCDVQPFLPVLRLVAREGDRVKKLINSQISLLIGKGLHEFDSLCDPEVNDFRAKMCQFCEEAAARRQQLGWEAWLQYSFPLQLEPSAQTWGPGTLRLPNRALLVNVKFEGSEESFTFQVSTKDVPLALMACALRKKATVFRQPLVEQPEDYTLQVNGRHEYLYGSYPLCQFQYICSCLHSGLTPHLTMVHSSSILAMRDEQSNPAPQVQKPRAKPPPIPAKKPSSVSLWSLEQPFRIELIQGSKVNADERMKLVVQAGLFHGNEMLCKTVSSSEVSVCSEPVWKQRLEFDINICDLPRMARLCFALYAVIEKAKKARSTKKKSKKADCPIAWANLMLFDYKDQLKTGERCLYMWPSVPDEKGELLNPTGTVRSNPNTDSAAALLICLPEVAPHPVYYPALEKILELGRHSECVHVTEEEQLQLREILERRGSGELYEHEKDLVWKLRHEVQEHFPEALARLLLVTKWNKHEDVAQMLYLLCSWPELPVLSALELLDFSFPDCHVGSFAIKSLRKLTDDELFQYLLQLVQVLKYESYLDCELTKFLLDRALANRKIGHFLFWHLRSEMHVPSVALRFGLILEAYCRGSTHHMKVLMKQGEALSKLKALNDFVKLSSQKTPKPQTKELMHLCMRQEAYLEALSHLQSPLDPSTLLAEVCVEQCTFMDSKMKPLWIMYSNEEAGSGGSVGIIFKNGDDLRQDMLTLQMIQLMDVLWKQEGLDLRMTPYGCLPTGDRTGLIEVVLRSDTIANIQLNKSNMAATAAFNKDALLNWLKSKNPGEALDRAIEEFTLSCAGYCVATYVLGIGDRHSDNIMIRESGQLFHIDFGHFLGNFKTKFGINRERVPFILTYDFVHVIQQGKTNNSEKFERFRGYCERAYTILRRHGLLFLHLFALMRAAGLPELSCSKDIQYLKDSLALGKTEEEALKHFRVKFNEALRESWKTKVNWLAHNVSKDNRQ","Homo sapiens","string:","6pyr_A|AF-O00329","Tclin","Kinase","2.985169","4.848008","3.133539","3.741594","3.077458","2.539187","3.657911","3.89517","3.530386","3.703338","3.792137","3.658839","3.885369","3.323066","2.546877","3.718144","3.708954","3.251201","3.001844","2.663117"
"stringdb:9606.ENSP00000362680","4.139325","5.0","3.016124","5.0","4.695726","2.639182","5.0","5.0","4.598955","2.257721","4.812014","9","SRC","SRC","SRC","SRC","false","SRC","SRC_HUMAN","9606.ENSP00000362680","Proto-oncogene tyrosine-protein kinase Src; Non-receptor protein tyrosine kinase which is activated following engagement of many different classes of cellular receptors including immune response receptors, integrins and other adhesion receptors, receptor protein tyrosine kinases, G protein-coupled receptors as well as cytokine receptors. Participates in signaling pathways that control a diverse spectrum of biological activities including gene transcription, immune response, cell adhesion, cell cycle progression, apoptosis, migration, and transformation. Due to functional redundancy bet [...] ","label: attribute=""display name"" labelsize=12 labelAlignment=left position=northeast outline=true outlineColor=white outlineTransparency=95 outlineWidth=10 background=false color=black dropShadow=false",,"https://version-12-0.string-db.org//images/Proteinpictures/pdb/2h/2h8h_A.png","stringdb","rgb(117,239,119)","protein","MGSNKSKPKDASQRRRSLEPAENVHGAGGGAFPASQTPSKPASADGHRGPSAAFAPAAAEPKLFGGFNSSDTVTSPQRAGPLAGGVTTFVALYDYESRTETDLSFKKGERLQIVNNTEGDWWLAHSLSTGQTGYIPSNYVAPSDSIQAEEWYFGKITRRESERLLLNAENPRGTFLVRESETTKGAYCLSVSDFDNAKGLNVKHYKIRKLDSGGFYITSRTQFNSLQQLVAYYSKHADGLCHRLTTVCPTSKPQTQGLAKDAWEIPRESLRLEVKLGQGCFGEVWMGTWNGTTRVAIKTLKPGTMSPEAFLQEAQVMKKLRHEKLVQLYAVVSEEPIYIVTEYMSKGSLLDFLKGETGKYLRLPQLVDMAAQIASGMAYVERMNYVHRDLRAANILVGENLVCKVADFGLARLIEDNEYTARQGAKFPIKWTAPEAALYGRFTIKSDVWSFGILLTELTTKGRVPYPGMVNREVLDQVERGYRMPCPPECPESLHDLMCQCWRKEPEERPTFEYLQAFLEDYFTSTEPQYQPGENL","Homo sapiens","string:","1hct_B|2h8h_A|2src_A|6e6e_A|7a3d_A|AF-P12931","Tclin","Kinase","3.122226","4.757369","2.962152","3.252734","2.989281","2.73604","3.521314","3.711226","3.611105","4.675072","4.739342","3.326721","3.616471","3.248838","2.52231","4.67093","3.363494","3.425592","2.844712","2.563075"
"stringdb:9606.ENSP00000263967","3.638838","4.877721","3.388259","3.090984","3.740023","2.997239","3.348377","4.168337","4.234375","2.909287","4.53947","9","PIK3CA","PIK3CA","PIK3CA","PIK3CA","false","PIK3CA","PK3CA_HUMAN","9606.ENSP00000263967","Phosphatidylinositol 4,5-bisphosphate 3-kinase catalytic subunit alpha isoform; Phosphoinositide-3-kinase (PI3K) that phosphorylates PtdIns (Phosphatidylinositol), PtdIns4P (Phosphatidylinositol 4-phosphate) and PtdIns(4,5)P2 (Phosphatidylinositol 4,5-bisphosphate) to generate phosphatidylinositol 3,4,5-trisphosphate (PIP3). PIP3 plays a key role by recruiting PH domain-containing proteins to the membrane, including AKT1 and PDPK1, activating signaling cascades involved in cell growth, survival, proliferation, motility and morphology. Participates in cellular signaling in response to v [...] ","label: attribute=""display name"" labelsize=12 labelAlignment=left position=northeast outline=true outlineColor=white outlineTransparency=95 outlineWidth=10 background=false color=black dropShadow=false",,"https://version-12-0.string-db.org//images/Proteinpictures/pdb/5d/5dxh_A.png","stringdb","rgb(135,239,117)","protein","MPPRPSSGELWGIHLMPPRILVECLLPNGMIVTLECLREATLITIKHELFKEARKYPLHQLLQDESSYIFVSVTQEAEREEFFDETRRLCDLRLFQPFLKVIEPVGNREEKILNREIGFAIGMPVCEFDMVKDPEVQDFRRNILNVCKEAVDLRDLNSPHSRAMYVYPPNVESSPELPKHIYNKLDKGQIIVVIWVIVSPNNDKQKYTLKINHDCVPEQVIAEAIRKKTRSMLLSSEQLKLCVLEYQGKYILKVCGCDEYFLEKYPLSQYKYIRSCIMLGRMPNLMLMAKESLYSQLPMDCFTMPSYSRRISTATPYMNGETSTKSLWVINSALRIKILCATYVNVNIRDIDKIYVRTGIYHGGEPLCDNVNTQRVPCSNPRWNEWLNYDIYIPDLPRAARLCLSICSVKGRKGAKEEHCPLAWGNINLFDYTDTLVSGKMALNLWPVPHGLEDLLNPIGVTGSNPNKETPCLELEFDWFSSVVKFPDMSVIEEHANWSVSREAGFSYSHAGLSNRLARDNELRENDKEQLKAISTRDPLSEITEQEKDFLWSHRHYCVTIPEILPKLLLSVKWNSRDEVAQMYCLVKDWPPIKPEQAMELLDCNYPDPMVRGFAVRCLEKYLTDDKLSQYLIQLVQVLKYEQYLDNLLVRFLLKKALTNQRIGHFFFWHLKSEMHNKTVSQRFGLLLESYCRACGMYLKHLNRQVEAMEKLINLTDILKQEKKDETQKVQMKFLVEQMRRPDFMDALQGFLSPLNPAHQLGNLRLEECRIMSSAKRPLWLNWENPDIMSELLFQNNEIIFKNGDDLRQDMLTLQIIRIMENIWQNQGLDLRMLPYGCLSIGDCVGLIEVVRNSHTIMQIQCKGGLKGALQFNSHTLHQWLKDKNKGEIYDAAIDLFTRSCAGYCVATFILGIGDRHNSNIMVKDDGQLFHIDFGHFLDHKKKKFGYKRERVPFVLTQDFLIVISKGAQECTKTREFERFQEMCYKAYLAIRQHANLFINLFSMMLGSGMPELQSFDDIAYIRKTLALDKTEQEALEYFMKQMNDAHHGGWTTKMDWIFHTIKQHALN","Homo sapiens","string:","2enq_A|2v1y_A|5dxh_A|6vo7_A|7jiu_A|AF-P42336","Tclin","Kinase","3.327829","3.978717","3.147208","3.56322","3.237718","2.8405","3.908272","4.2034","3.968199","3.813747","4.917646","3.797005","4.591407","3.706119","3.016103","3.495532","3.617703","3.361954","3.433547","2.732289"
"stringdb:9606.ENSP00000256078","3.159251","4.852893","4.533606","2.692453","3.244014","4.459287","2.721103","4.684237","3.924008","2.146759","5.0","9","KRAS","KRAS","KRAS","KRAS","false","KRAS","RASK_HUMAN","9606.ENSP00000256078","GTPase KRas, N-terminally processed; Ras proteins bind GDP/GTP and possess intrinsic GTPase activity. Plays an important role in the regulation of cell proliferation. Plays a role in promoting oncogenic events by inducing transcriptional silencing of tumor suppressor genes (TSGs) in colorectal cancer (CRC) cells in a ZNF304-dependent manner.","label: attribute=""display name"" labelsize=12 labelAlignment=left position=northeast outline=true outlineColor=white outlineTransparency=95 outlineWidth=10 background=false color=black dropShadow=false",,"https://version-12-0.string-db.org//images/Proteinpictures/pdb/7v/7vvb_A.png","stringdb","rgb(117,117,239)","protein","MTEYKLVVVGAGGVGKSALTIQLIQNHFVDEYDPTIEDSYRKQVVIDGETCLLDILDTAGQEEYSAMRDQYMRTGEGFLCVFAINNTKSFEDIHHYREQIKRVKDSEDVPMVLVGNKCDLPSRTVDTKQAQDLARSYGIPFIETSAKTRQRVEDAFYTLVREIRQYRLKKISKEEKTPGCVKIKKCIIM","Homo sapiens","string:","2n9c_A|5o2s_A|7vvb_A|AF-P01116","Tclin","Enzyme","2.692508","3.843249","2.405409","3.306364","2.392896","3.014044","3.364119","4.041057","3.452345","3.72702","4.796642","3.236846","4.847877","3.608215","2.760832","3.173103","3.50761","3.334707","3.844181","2.561751"
